{
  "id": "microduck-velocity-rough",
  "name": "Velocity · Rough",
  "subtitle": "粗糙地形行走",
  "inherits": "microduck-velocity-flat",
  "diffSummary": "与平地版共享奖励与观测，地形换成微台阶/鹅卵石/缓坡生成器，并加大接触求解迭代。",
  "verifiedAt": "2026-09-01",
  "verifiedRef": "pollen-robotics/microduck_rl@main · Mjlab-Velocity-Rough-MicroDuck",
  "links": {
    "microduck_rl 代码": "https://github.com/pollen-robotics/microduck_rl",
    "Microduck 真机运行时": "https://github.com/pollen-robotics/microduck",
    "mjlab 框架": "https://github.com/mujocolab/mjlab",
    "BAM 执行器模型": "https://github.com/Rhoban/bam",
    "任务注册": "https://github.com/pollen-robotics/microduck_rl/blob/main/src/mjlab_microduck/tasks/__init__.py"
  },
  "overrides": {
    "modes.train": {
      "summary": "与平地版共享奖励与观测，地形换成微台阶/鹅卵石/缓坡生成器，并加大接触求解迭代。",
      "facts": {
        "任务 ID": "Mjlab-Velocity-Rough-MicroDuck",
        "地形": "generator：台阶 ≤1.5 cm、鹅卵石 ≤1 cm、缓坡 1.7°–5.7°"
      },
      "nodes": {
        "s.scene": {
          "sub": "robot_walk.xml · 粗糙地形",
          "label": "MuJoCo 粗糙场景"
        }
      }
    }
  }
}
