{
  "id": "microduck-roulade",
  "name": "Roulade",
  "subtitle": "前滚翻落地",
  "inherits": "microduck-velocity-flat",
  "diffSummary": "用头顶前滚翻越过并落回双脚；使用全碰撞模型。",
  "verifiedAt": "2026-09-01",
  "verifiedRef": "pollen-robotics/microduck_rl@main · Mjlab-Roulade-Flat-MicroDuck",
  "links": {
    "microduck_rl 代码": "https://github.com/pollen-robotics/microduck_rl",
    "Microduck 真机运行时": "https://github.com/pollen-robotics/microduck",
    "mjlab 框架": "https://github.com/mujocolab/mjlab",
    "BAM 执行器模型": "https://github.com/Rhoban/bam",
    "任务注册": "https://github.com/pollen-robotics/microduck_rl/blob/main/src/mjlab_microduck/tasks/__init__.py"
  },
  "overrides": {
    "modes.train": {
      "summary": "用头顶前滚翻越过并落回双脚；使用全碰撞模型。",
      "facts": {
        "任务 ID": "Mjlab-Roulade-Flat-MicroDuck",
        "任务目标": "前滚翻（Roulade）"
      },
      "nodes": {
        "s.scene": {
          "sub": "robot_allcollisions.xml"
        }
      }
    }
  }
}
