{
  "id": "microduck-standup-rough",
  "name": "StandUp · Rough",
  "subtitle": "粗糙地面站起",
  "inherits": "microduck-velocity-flat",
  "diffSummary": "StandUp 在粗糙地形上的变体：从倒置或坐姿站起并维持站立。",
  "verifiedAt": "2026-09-01",
  "verifiedRef": "pollen-robotics/microduck_rl@main · Mjlab-StandUp-Rough-MicroDuck",
  "links": {
    "microduck_rl 代码": "https://github.com/pollen-robotics/microduck_rl",
    "Microduck 真机运行时": "https://github.com/pollen-robotics/microduck",
    "mjlab 框架": "https://github.com/mujocolab/mjlab",
    "BAM 执行器模型": "https://github.com/Rhoban/bam",
    "任务注册": "https://github.com/pollen-robotics/microduck_rl/blob/main/src/mjlab_microduck/tasks/__init__.py"
  },
  "overrides": {
    "modes.train": {
      "summary": "StandUp 在粗糙地形上的变体：从倒置或坐姿站起并维持站立。",
      "facts": {
        "任务 ID": "Mjlab-StandUp-Rough-MicroDuck",
        "地形": "粗糙地形生成器",
        "初始姿态": "仰卧/俯卧/坐姿随机",
        "任务目标": "站起 + 姿态保持"
      }
    }
  }
}
