{
  "id": "microduck-ballkick-flat",
  "name": "BallKick · Flat",
  "subtitle": "右脚踢球（策略不见球）",
  "inherits": "microduck-velocity-flat",
  "diffSummary": "从站立起步用右脚将 70 mm/15 g 球向前踢出；Actor 观测不含球状态。",
  "verifiedAt": "2026-09-01",
  "verifiedRef": "pollen-robotics/microduck_rl@main · Mjlab-BallKick-Flat-MicroDuck",
  "links": {
    "microduck_rl 代码": "https://github.com/pollen-robotics/microduck_rl",
    "Microduck 真机运行时": "https://github.com/pollen-robotics/microduck",
    "mjlab 框架": "https://github.com/mujocolab/mjlab",
    "BAM 执行器模型": "https://github.com/Rhoban/bam",
    "任务注册": "https://github.com/pollen-robotics/microduck_rl/blob/main/src/mjlab_microduck/tasks/__init__.py"
  },
  "overrides": {
    "modes.train": {
      "summary": "从站立起步用右脚将 70 mm/15 g 球向前踢出；Actor 观测不含球状态。",
      "facts": {
        "任务 ID": "Mjlab-BallKick-Flat-MicroDuck",
        "任务目标": "踢球",
        "观测": "球盲（ball-blind）"
      },
      "nodes": {
        "s.scene": {
          "sub": "robot_allcollisions.xml + 球"
        }
      }
    }
  }
}
