{
  "id": "microduck-roller-slope",
  "name": "RollerSlope",
  "subtitle": "斜坡轮滑下滑",
  "inherits": "microduck-velocity-flat",
  "diffSummary": "在斜坡地形上轮滑下滑；奖励以 wheel_glide 为主。",
  "verifiedAt": "2026-09-01",
  "verifiedRef": "pollen-robotics/microduck_rl@main · Mjlab-RollerSlope-Flat-MicroDuck",
  "links": {
    "microduck_rl 代码": "https://github.com/pollen-robotics/microduck_rl",
    "Microduck 真机运行时": "https://github.com/pollen-robotics/microduck",
    "mjlab 框架": "https://github.com/mujocolab/mjlab",
    "BAM 执行器模型": "https://github.com/Rhoban/bam",
    "任务注册": "https://github.com/pollen-robotics/microduck_rl/blob/main/src/mjlab_microduck/tasks/__init__.py"
  },
  "overrides": {
    "modes.train": {
      "summary": "在斜坡地形上轮滑下滑；奖励以 wheel_glide 为主。",
      "facts": {
        "任务 ID": "Mjlab-RollerSlope-Flat-MicroDuck",
        "地形": "斜坡",
        "碰撞模型": "robot_allcollisions_rollers.xml",
        "任务目标": "坡面滑行"
      },
      "nodes": {
        "s.scene": {
          "sub": "robot_allcollisions_rollers.xml · 斜坡"
        }
      }
    }
  }
}
